{"budget_status":"not_declared","checks":[{"artifact_sha256":"6542b46c415373fb094fc285befb62e715bda4b9248d2da7f24acecabe8504a6","check_id":"check.mean-score","excluded_missing":0,"expected":"0","kind":"numeric_reproduction","observed":"0","reasons":[],"sample_count":3,"status":"passed"}],"claim_id":"claim.accuracy-gain","claim_sha256":"cccccccccccccccccccccccccccccccccccccccccccccccccccccccccccccccc","contract_id":"contract.claim-001","contract_sha256":"b64d29ca80c5b2aa419b20c530857d6263b5566f11a57895cbe412d10be0d2aa","contract_version":1,"evaluator_version":"1.0.0","overall_status":"passed","predeclaration":"predeclaration_unverified","provenance_sha256":"ce09cb48fbce76676fd8182a7d5cab243ee5538b7e7c2474d2cd452dddbd5adc","schema_version":"arw.experiment-acceptance.v1","scope":"contract_conformance_only"}
