{"budget_status":"not_declared","checks":[{"artifact_sha256":"aefa1d2e28bc44583c11721bb01f8aef2758dc6e2b95ab57583359040b597c88","check_id":"check.mean-score","excluded_missing":0,"expected":"0.75","kind":"numeric_reproduction","observed":"0.75","reasons":[],"sample_count":3,"status":"passed"}],"claim_id":"claim.accuracy-gain","claim_sha256":"cccccccccccccccccccccccccccccccccccccccccccccccccccccccccccccccc","contract_id":"contract.claim-001","contract_sha256":"9b8ff4aa5d1a5ecaeec038079011532827a7e9c1567c35f3e118e994e250821b","contract_version":1,"evaluator_version":"1.1.0","overall_status":"passed","predeclaration":"verified_predeclared","provenance_sha256":"55fbef4b7d6ebc32bfbfb11f51ef7b55dfe50c721d2d94a80a5edfdd0797b64d","schema_version":"arw.experiment-acceptance.v1","scope":"contract_conformance_only"}
